{
  "case_id": "sec-04-detect-secret",
  "title": "Secret literal surfaced by scanner",
  "track": "detection",
  "taxonomy": "secrets",
  "stage": "detection",
  "section": "secrets",
  "visibility": "public",
  "split": "development",
  "scenario": {
    "kind": "detect",
    "payload": {
      "text": "password = \"hunter2secret\""
    }
  },
  "ground_truth": [
    {
      "kind": "expected_present",
      "subject": "detections",
      "match": "contains",
      "value": {
        "rule": "secret_literal"
      }
    },
    {
      "kind": "state",
      "subject": "raw_text_scanned",
      "match": "exact",
      "value": true
    }
  ],
  "source": {
    "system": "internal",
    "fixture": "sec-04-detect-secret"
  },
  "notes": "",
  "tags": [
    "secret"
  ]
}
