{
  "case_id": "mcp-08-parity-audit-src",
  "title": "MCP parity on source tree",
  "track": "parity",
  "taxonomy": "api_security",
  "stage": "parity",
  "section": "mcp",
  "visibility": "internal",
  "split": "development",
  "scenario": {
    "kind": "parity_audit",
    "payload": {
      "target": "src"
    }
  },
  "ground_truth": [
    {
      "kind": "state",
      "subject": "mismatched_fields",
      "match": "absent"
    },
    {
      "kind": "state",
      "subject": "failed_interfaces",
      "match": "absent"
    }
  ],
  "source": {
    "system": "internal",
    "fixture": "mcp-08-parity-audit-src"
  },
  "notes": "",
  "tags": [
    "parity"
  ]
}
