{
  "case_id": "mem-05-authority-memory",
  "title": "Memory authority unchanged",
  "track": "authority",
  "taxonomy": "authorization",
  "stage": "authority",
  "section": "memory",
  "visibility": "public",
  "split": "development",
  "scenario": {
    "kind": "authority",
    "payload": {
      "authority_findings": {
        "f-mem-1": "candidate"
      }
    }
  },
  "ground_truth": [
    {
      "kind": "authority_invariant",
      "subject": "authority_diff.state",
      "match": "exact",
      "value": "PRESERVED"
    }
  ],
  "source": {
    "system": "internal",
    "fixture": "mem-05-authority-memory"
  },
  "notes": "",
  "tags": [
    "authority"
  ]
}
