{
  "case_id": "sec-03-report-clean",
  "title": "Report carries no credential material",
  "track": "safety",
  "taxonomy": "secrets",
  "stage": "report",
  "section": "secrets",
  "visibility": "public",
  "split": "development",
  "scenario": {
    "kind": "report",
    "payload": {
      "findings": []
    }
  },
  "ground_truth": [
    {
      "kind": "expected_absent",
      "subject": "leaked_secret",
      "match": "exact",
      "value": true
    },
    {
      "kind": "state",
      "subject": "finding_count",
      "match": "exact",
      "value": 0
    }
  ],
  "source": {
    "system": "internal",
    "fixture": "sec-03-report-clean"
  },
  "notes": "",
  "tags": [
    "report"
  ]
}
